{
  "schema_id": "asklegal.hk-regulatory.boundary-decision-report",
  "schema_version": "1.0.0",
  "rule_id": "HKREG-BOUNDARY-DECISION-001",
  "case_id": "HKREG-DEC-BND-023",
  "assertion_scope": "CROSS_REFERENCE",
  "observed_decision": {
    "schema_id": "asklegal.hk-regulatory.boundary-decision-result",
    "schema_version": "1.0.0",
    "rule_id": "HKREG-BOUNDARY-DECISION-001",
    "case_id": "HKREG-DEC-BND-023",
    "outcome": "PASS",
    "reason": "REFERENCE_CHAIN_PRESERVED",
    "responsibilities": [],
    "dependency_owners": [],
    "references": [
      {
        "referring_unit_id": "unit-23-a",
        "referring_words": "see rule-23-b",
        "referring_scope_id": "HK-REG-HKEX-MAIN-BOARD",
        "target_locator": "rule-23-b",
        "target_heading": "Rule B",
        "target_scope_id": "HK-REG-HKEX-MAIN-BOARD",
        "resolution": "RESOLVED",
        "target_text_included": false
      },
      {
        "referring_unit_id": "unit-23-b",
        "referring_words": "see rule-23-c",
        "referring_scope_id": "HK-REG-HKEX-MAIN-BOARD",
        "target_locator": "rule-23-c",
        "target_heading": "Rule C",
        "target_scope_id": "HK-REG-HKEX-MAIN-BOARD",
        "resolution": "RESOLVED",
        "target_text_included": false
      }
    ],
    "excluded_background_unit_ids": [],
    "quarantined_unit_ids": [],
    "rejected_candidate": false,
    "source_contract_review_required": false,
    "quarantined_branch": false,
    "presentation_identity_rejected": false,
    "relationship_revision_only": false,
    "referring_payload_change_required": false,
    "search_record_authorized": false,
    "embedding_authorized": false,
    "release_authorized": false,
    "serving_authorized": false,
    "external_effects": "NONE"
  },
  "expected_decision": {
    "schema_id": "asklegal.hk-regulatory.boundary-decision-result",
    "schema_version": "1.0.0",
    "rule_id": "HKREG-BOUNDARY-DECISION-001",
    "case_id": "HKREG-DEC-BND-023",
    "outcome": "PASS",
    "reason": "REFERENCE_CHAIN_PRESERVED",
    "responsibilities": [],
    "dependency_owners": [],
    "references": [
      {
        "referring_unit_id": "unit-23-a",
        "referring_words": "see rule-23-b",
        "referring_scope_id": "HK-REG-HKEX-MAIN-BOARD",
        "target_locator": "rule-23-b",
        "target_heading": "Rule B",
        "target_scope_id": "HK-REG-HKEX-MAIN-BOARD",
        "resolution": "RESOLVED",
        "target_text_included": false
      },
      {
        "referring_unit_id": "unit-23-b",
        "referring_words": "see rule-23-c",
        "referring_scope_id": "HK-REG-HKEX-MAIN-BOARD",
        "target_locator": "rule-23-c",
        "target_heading": "Rule C",
        "target_scope_id": "HK-REG-HKEX-MAIN-BOARD",
        "resolution": "RESOLVED",
        "target_text_included": false
      }
    ],
    "excluded_background_unit_ids": [],
    "quarantined_unit_ids": [],
    "rejected_candidate": false,
    "source_contract_review_required": false,
    "quarantined_branch": false,
    "presentation_identity_rejected": false,
    "relationship_revision_only": false,
    "referring_payload_change_required": false,
    "search_record_authorized": false,
    "embedding_authorized": false,
    "release_authorized": false,
    "serving_authorized": false,
    "external_effects": "NONE"
  },
  "conformance_status": "PASS",
  "source_authorized": false,
  "provider_authorized": false,
  "release_authorized": false,
  "serving_authorized": false,
  "deployment_authorized": false,
  "external_effects": "NONE"
}
