{
  "schema_id": "asklegal.hk-regulatory.boundary-decision-report",
  "schema_version": "1.0.0",
  "rule_id": "HKREG-BOUNDARY-DECISION-001",
  "case_id": "HKREG-DEC-BND-010",
  "assertion_scope": "DEFINITION",
  "observed_decision": {
    "schema_id": "asklegal.hk-regulatory.boundary-decision-result",
    "schema_version": "1.0.0",
    "rule_id": "HKREG-BOUNDARY-DECISION-001",
    "case_id": "HKREG-DEC-BND-010",
    "outcome": "PASS",
    "reason": "TERM_DEFINITIONS_SELECTED",
    "responsibilities": [
      {
        "record_unit_id": "record-term-10-a",
        "kind": "DEFINITION",
        "primary_source_unit_ids": [
          "term-10-a"
        ],
        "dependency_source_unit_ids": [
          "definition-scope-10"
        ]
      },
      {
        "record_unit_id": "record-term-10-b",
        "kind": "DEFINITION",
        "primary_source_unit_ids": [
          "term-10-b"
        ],
        "dependency_source_unit_ids": [
          "definition-scope-10"
        ]
      }
    ],
    "dependency_owners": [],
    "references": [],
    "excluded_background_unit_ids": [],
    "quarantined_unit_ids": [],
    "rejected_candidate": false,
    "source_contract_review_required": false,
    "quarantined_branch": false,
    "presentation_identity_rejected": false,
    "relationship_revision_only": false,
    "referring_payload_change_required": false,
    "search_record_authorized": false,
    "embedding_authorized": false,
    "release_authorized": false,
    "serving_authorized": false,
    "external_effects": "NONE"
  },
  "expected_decision": {
    "schema_id": "asklegal.hk-regulatory.boundary-decision-result",
    "schema_version": "1.0.0",
    "rule_id": "HKREG-BOUNDARY-DECISION-001",
    "case_id": "HKREG-DEC-BND-010",
    "outcome": "PASS",
    "reason": "TERM_DEFINITIONS_SELECTED",
    "responsibilities": [
      {
        "record_unit_id": "record-term-10-a",
        "kind": "DEFINITION",
        "primary_source_unit_ids": [
          "term-10-a"
        ],
        "dependency_source_unit_ids": [
          "definition-scope-10"
        ]
      },
      {
        "record_unit_id": "record-term-10-b",
        "kind": "DEFINITION",
        "primary_source_unit_ids": [
          "term-10-b"
        ],
        "dependency_source_unit_ids": [
          "definition-scope-10"
        ]
      }
    ],
    "dependency_owners": [],
    "references": [],
    "excluded_background_unit_ids": [],
    "quarantined_unit_ids": [],
    "rejected_candidate": false,
    "source_contract_review_required": false,
    "quarantined_branch": false,
    "presentation_identity_rejected": false,
    "relationship_revision_only": false,
    "referring_payload_change_required": false,
    "search_record_authorized": false,
    "embedding_authorized": false,
    "release_authorized": false,
    "serving_authorized": false,
    "external_effects": "NONE"
  },
  "conformance_status": "PASS",
  "source_authorized": false,
  "provider_authorized": false,
  "release_authorized": false,
  "serving_authorized": false,
  "deployment_authorized": false,
  "external_effects": "NONE"
}
